retrieved_at,query,tweet_created_at,tweet_url,tweet_id,tweet_type,in_reply_to_name,referenced_tweets,sensitive,lang,username,user_id,text,rt_count,reply_count,like_count,quote_count,impression_count,has_media,if_video_duration,if_video_views,media_url,ent_hashtags,ent_mentions,ent_anotation_types,ent_anotation_elements,place_name,visible_user_name,followers_count,following_count,user_total_tweets,listed_on
2023-05-09 10:36:56.333894,(inmigrantes Barcelona OR inmigración Barcelona) lang:es -is:retweet,2023-04-15T20:51:52.000Z,https://twitter.com/elhipitalista/status/1647341993389858817,1647341993389858817,replied_to,None,https://twitter.com/elhipitalista/status/1647341993389858817/photo/1,False,es,elhipitalista,1427274931558092800,"@JaviMunozF Si no fijamos en Barcelona, que es donde se recogieron los datos, vemos que de cada 48.812 delitos, 28.771 son de españoles (Lo cual quiere decir que 20.041 son de inmigrantes) Y de los inmigrantes 7.229 pertenecen a nacionalidades africanas + https://t.co/wzkzVBoPrR",0,1,0,0,28,['photo'],None,None,['https://pbs.twimg.com/media/FtyIZ27XwAE9zvn.png'],false,JaviMunozF,Place,Barcelona,false,Danak El Hipitalista,1577,461,12612,9
2023-05-09 10:36:56.333894,(inmigrantes Barcelona OR inmigración Barcelona) lang:es -is:retweet,2023-04-15T19:40:54.000Z,https://twitter.com/achuchones/status/1647324136010657793,1647324136010657793,quoted,false,https://twitter.com/achuchones/status/1647324136010657793/photo/1,False,es,achuchones,425786423,"Sigue sin permitir respuestas
El SMI ha empeorado la contratación de no cualificados, inmigrantes y mujeres
La reforma semántica ha opacado las cifras reales de paro
Peatonalizar con cabeza, no a tontas y locas
Volver a los contratos de renta antigua ya fastidiaron Barcelona https://t.co/18sd7slxrF https://t.co/3HOa2SpFI4",0,0,0,0,58,"['photo', 'photo', 'photo']",None,None,"['https://pbs.twimg.com/media/Ftx4kEwWAAIwBAs.jpg', 'https://pbs.twimg.com/media/Ftx4kSuWwAIZfBJ.jpg', 'https://pbs.twimg.com/media/Ftx4kl4WIAARYaH.jpg']",false,false,Organization;Place,SMI;Barcelona,false,𝐼𝓈𝒶𝒷𝑒𝓁 𝐵𝒶𝓇𝓇𝑒𝓉𝑜,1471,2590,123406,14
2023-05-09 10:36:56.333894,(inmigrantes Barcelona OR inmigración Barcelona) lang:es -is:retweet,2023-04-15T18:15:46.000Z,https://twitter.com/Harnolld_/status/1647302712818556928,1647302712818556928,replied_to,None,https://okdiario.com/baleares/detenido-marroqui-felanitx-violar-nina-13-anos-10102096/amp,False,es,Harnolld_,801175230664310784,"@QeSImevoyvolndo @324cat https://t.co/K7QU65ZcXN aquí tienes uno. Gráfico de delincuencia en Barcelona. El 51% de las agresiones sexuales cometidas por el 15% de la población, los cuales la mayoría de inmigrantes son marroquíes. Tampoco se cuentan los nacionalizados. https://t.co/YM3ChRpBbM",0,0,0,0,54,['photo'],None,None,['https://pbs.twimg.com/media/FtxlFaIX0AAhnNX.jpg'],false,QeSImevoyvolndo;324cat,Place,Barcelona,false,Harnolld,80,398,1670,0
2023-05-09 10:36:56.333894,(inmigrantes Barcelona OR inmigración Barcelona) lang:es -is:retweet,2023-04-15T18:14:44.000Z,https://twitter.com/elhipitalista/status/1647302453065404420,1647302453065404420,replied_to,None,https://twitter.com/elhipitalista/status/1647302453065404420/photo/1,False,es,elhipitalista,1427274931558092800,"@JaviMunozF En cuanto a la población, así es como se desglosa la inmigración en Barcelona. Sin la nacionalidad concreta, la mayoria de los delitos deberían cometerlos Italianos y los magrebies cometerian un % muy pequeño + https://t.co/7UZzgeiA7y",1,2,1,0,43,['photo'],None,None,['https://pbs.twimg.com/media/Ftxk2S6XsAAYpVE.jpg'],false,JaviMunozF,Place,Barcelona,false,Danak El Hipitalista,1577,461,12612,9
2023-05-09 10:36:56.333894,(inmigrantes Barcelona OR inmigración Barcelona) lang:es -is:retweet,2023-04-15T17:32:00.000Z,https://twitter.com/naacho_gl/status/1647291695980003329,1647291695980003329,quoted,false,https://twitter.com/wallstwolverine/status/1646689077704417280,False,es,naacho_gl,3579013289,"Aunque sea muy sensacional el dato, hay que hacer dos apuntes:

1. Extranjeros de dónde? En Barcelona hay mucho turismo y los turistas a veces la lían. 
2. Aunque todos ellos fueran inmigrantes magreíes, probablemente la pobreza tenga más que ver que la nacionalidad. https://t.co/csqpsrD6Sf",0,3,1,1,1043,['false'],0,0,['false'],false,false,Place,Barcelona,false,Nacho 🐺,1515,1025,13683,5
2023-05-09 10:36:56.333894,(inmigrantes Barcelona OR inmigración Barcelona) lang:es -is:retweet,2023-04-15T13:56:00.000Z,https://twitter.com/Jeseg3568/status/1647237339255652352,1647237339255652352,replied_to,Puntual24H,https://twitter.com/Puntual24H/status/1646910396182216704,False,es,Jeseg3568,1238068512297496577,"@Puntual24H Y no le falta razón.
Lo que no ha dicho es en qué es referente: en inmigración ilegal, en violaciones, robos, agresiones e inseguridad ciudadana.
Todo un referente en lo que no ha de convertirse una ciudad.
Todo un referente de como la idílica Barcelona olímpica puede degenerar.",0,0,4,0,44,['false'],0,0,['false'],false,Puntual24H,Place,Barcelona olímpica,false,Jeseg,6423,3969,35283,0
2023-05-09 10:36:56.333894,(inmigrantes Barcelona OR inmigración Barcelona) lang:es -is:retweet,2023-04-15T11:31:12.000Z,https://twitter.com/sspanishgringo1/status/1647200899918442497,1647200899918442497,replied_to,None,https://twitter.com/sspanishgringo1/status/1647200899918442497/photo/1,False,es,sspanishgringo1,1591401037205733376,"@_patricia_rueda @VOX_Cataluna @tonilopez_Vox @VOX_tarragona @VoxLerida @vox_barcelona @VOXGerona_ @IsabelLazaro_ poco os pasa

dad gracias

lo que debemos hacer los meter odio hacia vosotros en los inmigrantes que tanto odio metéis a diario contra ellos!!

os gusta la idea? pues eso es lo que hacéis vosotros!!

Cuidado, estáis tocando el pan de muchas familias mas decentes que vosotros https://t.co/x02Tm1bpYN",0,0,0,0,20,['photo'],None,None,['https://pbs.twimg.com/media/FtwIeRGWcAIjx9v.jpg'],false,_patricia_rueda;VOX_Cataluna;tonilopez_Vox;VOX_tarragona;VoxLerida;vox_barcelona;VOXGerona_;IsabelLazaro_,false,false,false,soyloprohibido1,20,176,2842,0
2023-05-09 10:36:56.333894,(inmigrantes Barcelona OR inmigración Barcelona) lang:es -is:retweet,2023-04-15T09:55:12.000Z,https://twitter.com/reyalexiiitooo_/status/1647176738282131456,1647176738282131456,replied_to,None,https://twitter.com/None/status/1647162223473876994,False,es,reyalexiiitooo_,804157901636042752,"@Paisvalencia09 @electo_mania Sisi, está visto que Valencia está avanzando mucho, sobre todo en delincuencia, violaciones, inmigración etc no? Está bien que quieras que tu ciudad sea Barcelona 2.0",0,1,0,0,31,['false'],0,0,['false'],false,Paisvalencia09;electo_mania,Organization;Organization,Valencia;Barcelona,false,Alex🇪🇸,328,610,12147,1
2023-05-09 10:36:56.333894,(inmigrantes Barcelona OR inmigración Barcelona) lang:es -is:retweet,2023-04-15T02:53:26.000Z,https://twitter.com/MarguelloJavier/status/1647070599041146885,1647070599041146885,replied_to,false,https://twitter.com/false/status/1647064618055901184,False,es,MarguelloJavier,1372752359701454853,"CUANDO SE HABLA DE PROBLEMA DE LA VIVIENDA. QUIEN TIENE UN PROBLEMA DE VIVIENDA??? QUIEN LE COMPRA UN PISO SUS PADRES NO. EN UNA ZONA RURAL O GUADALAJARA O BADAJOZ UN PISO NUEVO POR 80000-10000 EUROS TAMPOCO. EN MADRID, BILBAO, SAN SEBASTIAN, BARCELONA O LOS INMIGRANTES PUES SI",0,2,0,0,216,['false'],0,0,['false'],false,false,Place;Person,MADRID;BILBAO,false,JAVIER SANTIBAÑEZ MARGÜELLO,141,1,36481,0
2023-05-09 10:36:56.333894,(inmigrantes Barcelona OR inmigración Barcelona) lang:es -is:retweet,2023-04-14T19:56:50.000Z,https://twitter.com/info288/status/1646965756117106688,1646965756117106688,original,false,https://www.lavanguardia.com/vida/20230414/8894876/mujer-rubi-violada-grupo-nave-abandonada-26-diciembre.html,False,es,info288,994693789267750913,"⚖️ Prisión provisional sin fianza para 5 marroquíes por violar a una mujer en una nave abandonada #Barcelona #Inmigración

https://t.co/X3i45XeN85",0,0,0,0,42,['false'],0,0,['false'],Barcelona;Inmigración,false,Place,Barcelona,false,Info 288,1984,4,57225,29
2023-05-09 10:36:56.333894,(inmigrantes Barcelona OR inmigración Barcelona) lang:es -is:retweet,2023-04-14T19:01:25.000Z,https://twitter.com/marcos91376548/status/1646951810144391174,1646951810144391174,replied_to,None,https://twitter.com/None/status/1646950344977416192,False,es,marcos91376548,1108876839185977344,@armantifa2 @JCotomia @dsantosfacher Creo que señalar un problema real con la inmigración ilegal no es ser racista. Podemos seguir ignorándolo y que sigan ocurriendo estas cosas. La realidad es que en Barcelona el 15% de los inmigrantes cometen más del 60% de las agresiones sexuales.,0,0,1,0,60,['false'],0,0,['false'],false,armantifa2;JCotomia;dsantosfacher,Place,Barcelona,false,marcos,7,50,1737,0
2023-05-09 10:36:56.333894,(inmigrantes Barcelona OR inmigración Barcelona) lang:es -is:retweet,2023-04-14T18:25:49.000Z,https://twitter.com/edsanin/status/1646942854818721793,1646942854818721793,quoted,false,https://twitter.com/wallstwolverine/status/1646689077704417280,False,es,edsanin,1247583337,La cuestión es cuántos delitos se habrían cometido en Barcelona sin inmigración ilegal https://t.co/HZAhblS9dK,0,0,0,0,32,['false'],0,0,['false'],false,false,Place,Barcelona,false,Eduardo Sanín,652,283,152309,34
2023-05-09 10:36:56.333894,(inmigrantes Barcelona OR inmigración Barcelona) lang:es -is:retweet,2023-04-14T17:42:31.000Z,https://twitter.com/EmiMG_10/status/1646931954787295239,1646931954787295239,replied_to,PabloLucini3,https://twitter.com/PabloLucini3/status/1646928677286936576,False,es,EmiMG_10,221749118,"@PabloLucini3 La inmigración que llega a Barcelona sí, sin ninguna duda, por el resto de España también hay casos, pero ni punto de comparación.",1,1,2,0,653,['false'],0,0,['false'],false,PabloLucini3,Place;Place,Barcelona;España,false,El-GüanSanto,758,1013,18906,2
2023-05-09 10:36:56.333894,(inmigrantes Barcelona OR inmigración Barcelona) lang:es -is:retweet,2023-04-14T17:29:29.000Z,https://twitter.com/PabloLucini3/status/1646928677286936576,1646928677286936576,original,false,https://twitter.com/PabloLucini3/status/1646928677286936576/photo/1,False,es,PabloLucini3,1258094982667407361,"En Barcelona, los extranjeros cometen el 48,8% de las infracciones, el 50% de los homicidios, el 51,2% de las violaciones, el 72% de los robos en vía pública y el 61,7% de los robos en casas, siendo solo el 15,3% de la población.

¿Podemos decir ya que inmigración = delincuencia? https://t.co/YyxhvdveEG",2695,139,3854,67,81346,"['photo', 'photo', 'photo']",None,None,"['https://pbs.twimg.com/media/FtsQ5cXWYBsoMce.jpg', 'https://pbs.twimg.com/media/FtsQ5odWYAE3dxS.jpg', 'https://pbs.twimg.com/media/FtsQ53QWYBo0owp.jpg']",false,false,Place,Barcelona,false,Pablo Lucini,21825,122,9332,65
2023-05-09 10:36:56.333894,(inmigrantes Barcelona OR inmigración Barcelona) lang:es -is:retweet,2023-04-14T15:44:25.000Z,https://twitter.com/toketiko/status/1646902234112720899,1646902234112720899,replied_to,jbasalo1970,https://twitter.com/toketiko/status/1646902234112720899/photo/1,False,es,toketiko,948327096736153603,"@jbasalo1970 Es el primero q advirtió q Barcelona sería la primera ciudad española en caer en una situación delictiva inabordable por la política laxa sobre inmigración ilegal. Hoy, el 15.4% de extranjeros comenten allí más de la mitad de agresiones sexuales, homicidios y robos con violencia. https://t.co/Pvd4z1FZPI",1,0,3,0,197,['photo'],None,None,['https://pbs.twimg.com/media/Ftr42n4WIAE_8Q8.jpg'],false,jbasalo1970,Place,Barcelona,false,Toketiko,83,271,3068,0
2023-05-09 10:36:56.333894,(inmigrantes Barcelona OR inmigración Barcelona) lang:es -is:retweet,2023-04-14T14:58:49.000Z,https://twitter.com/tictact18170744/status/1646890759142948864,1646890759142948864,replied_to,viquirepublica,https://twitter.com/viquirepublica/status/1646828908279476224,False,es,tictact18170744,1236024353705398272,"@viquirepublica Barcelona con mucha inmigración andaluza y del resto de España PIB 171.350.447
El resto de provincias sin casi influencia de España son pobres  retrasadas y viven del expolio de Barcelona
Tarragona PIB 24.567.640
Lerida PIB 12.218.853
Gerona PIB 21.202.782",0,0,0,0,25,['false'],0,0,['false'],false,viquirepublica,Place;Place;Other;Place;Place;Place;Other;Other,Barcelona;España;PIB;España;Barcelona;Tarragona;PIB;PIB,false,tictactictac,1935,541,63774,1
2023-05-09 10:36:56.333894,(inmigrantes Barcelona OR inmigración Barcelona) lang:es -is:retweet,2023-04-14T14:13:38.000Z,https://twitter.com/EmilioGRanz/status/1646879390528045056,1646879390528045056,replied_to,Macca15Paul,https://twitter.com/Macca15Paul/status/1646841264128532481,False,es,EmilioGRanz,1428767253160419329,"@Macca15Paul Ada Colau, la que ha llenado (los acogía con los brazos abiertos) Barcelona de INMIGRANTES ILEGALES que no se adaptan a nuestras costumbres y VIOLAN A MUJERES y ROBAN (las estadísticas están ahí), mientras perdió la oportunidad que la torre Agbar pudiera tener un hotel=empleo=💸",0,0,0,0,3,['false'],0,0,['false'],false,Macca15Paul,Other;Place;Person,Ada Colau;Barcelona;ROBAN,false,Emilio García 🏳️‍🌈 💙 🇪🇸,933,1113,12563,13
2023-05-09 10:36:56.333894,(inmigrantes Barcelona OR inmigración Barcelona) lang:es -is:retweet,2023-04-14T14:04:11.000Z,https://twitter.com/NacionalFESP/status/1646877008834580481,1646877008834580481,replied_to,None,https://twitter.com/NacionalFESP/status/1646877008834580481/photo/1,False,es,NacionalFESP,1575837047264509952,@IlitxJaume @Ramo616Ramiro No estás tú para hablar. Bonita se os está quedando Cataluñistán con la inmigración. Reíros porque vais a necesitar otro Joan I para limpiar solamente Barcelona. https://t.co/Vi3Tj72gvO,0,0,1,0,36,"['photo', 'photo', 'photo', 'photo']",None,None,"['https://pbs.twimg.com/media/FtrhtUkX0AIAypp.png', 'https://pbs.twimg.com/media/FtrhuYbXoAMht9J.jpg', 'https://pbs.twimg.com/media/FtrhvleWAAAQlUD.png', 'https://pbs.twimg.com/media/Ftrh3ZNXoAAd1uI.png']",false,IlitxJaume;Ramo616Ramiro,Place;Person;Organization,Cataluñistán;Joan I;Barcelona,false,SpanishNacionalist 🟥⬛🟥​🇪🇸,251,181,1586,0
2023-05-09 10:36:56.333894,(inmigrantes Barcelona OR inmigración Barcelona) lang:es -is:retweet,2023-04-14T12:45:53.000Z,https://twitter.com/basadokflipas/status/1646857304254365698,1646857304254365698,replied_to,None,https://twitter.com/basadokflipas/status/1646857304254365698/photo/1,False,es,basadokflipas,1631636873725485058,"@HugoBalaclava @CesarAlvCa Hay que echarlo. Y no me taches de racista ni nada, simplemente soy objetivo. Cuantos chinos inmigrantes conoces o has visto vídeos en españa pegando puñaladas? Adjunto también datos del año pasado de delincuencia en barcelona https://t.co/xtY94CofI8",0,0,0,0,16,['photo'],None,None,['https://pbs.twimg.com/media/FtrP_I2XoAQIu7y.jpg'],false,HugoBalaclava;CesarAlvCa,Place,barcelona,false,factores,2,58,408,0
2023-05-09 10:36:56.333894,(inmigrantes Barcelona OR inmigración Barcelona) lang:es -is:retweet,2023-04-14T11:00:00.000Z,https://twitter.com/info288/status/1646830660898914308,1646830660898914308,replied_to,false,https://www.20minutos.es/noticia/5118638/0/en-libertad-el-unico-menor-en-regimen-cerrado-por-la-violacion-multiple-de-badalona/,False,es,info288,994693789267750913,"👮🏻‍♂️ En libertad el único menor (de etnia gitana) en régimen cerrado por la violación múltiple de Badalona #Barcelona #Inmigración 

https://t.co/zb7NgDVvzC",0,1,0,0,66,['false'],0,0,['false'],Barcelona;Inmigración,false,Place;Place,e Badalo; #Barcelo,false,Info 288,1984,4,57225,29
2023-05-09 10:36:56.333894,(inmigrantes Barcelona OR inmigración Barcelona) lang:es -is:retweet,2023-04-14T09:55:44.000Z,https://twitter.com/angrydyslexic/status/1646814486089682946,1646814486089682946,replied_to,mary_boleyn,https://twitter.com/mary_boleyn/status/1646811546956312576,False,es,angrydyslexic,3770424197,"@mary_boleyn Mi abuela lleva 60 años aquí (Barcelona) y tampoco ha aprendido nunca. Tal vez si no se les hubiese apartado por ser inmigrantes del resto de España y/o no hubieran vivido en entornos completamente aislados, habría aprendido. Pero tú dirás, entre franquismo y entorno imposible",0,0,1,0,39,['false'],0,0,['false'],false,mary_boleyn,Place;Place,Barcelona;España,false,freefirefreak,231,575,51527,5
2023-05-09 10:36:56.333894,(inmigrantes Barcelona OR inmigración Barcelona) lang:es -is:retweet,2023-04-14T06:13:18.000Z,https://twitter.com/cronicaglobal/status/1646758509877383168,1646758509877383168,original,false,https://bit.ly/41qgPar,False,es,cronicaglobal,81081065,"Pensamiento | ""La 'andaluzofobia' no es nueva en Cataluña. Desde principios del s. XX, con la llegada de murcianos y almerienses, se fue extendiendo en Barcelona un discurso racista contra la inmigración"", por @manupediaz_ Vía @cronicaglobal https://t.co/K6YScrzsvj",4,1,6,1,546,['false'],0,0,['false'],false,manupediaz_;cronicaglobal,Place;Place,Cataluña;Barcelona,false,Crónica Global,40692,9718,396359,748
2023-05-09 10:36:56.333894,(inmigrantes Barcelona OR inmigración Barcelona) lang:es -is:retweet,2023-04-13T15:34:11.000Z,https://twitter.com/juan_redard/status/1646537272584445952,1646537272584445952,replied_to,None,https://twitter.com/None/status/1646520523151777793,False,es,juan_redard,1388227732543311875,@CalaveraUn @CapitanBitcoin Tienes más Fe que las marchilongas si piensas que voy a cambiar mi voto para votar a gente amante de dejar a los violadores en la calle o inmigrantes a machetazos en Barcelona.,0,0,0,0,65,['false'],0,0,['false'],false,CalaveraUn;CapitanBitcoin,Place,Barcelona,false,juan castro redard,10,85,2168,0
2023-05-09 10:36:56.333894,(inmigrantes Barcelona OR inmigración Barcelona) lang:es -is:retweet,2023-04-13T13:12:58.000Z,https://twitter.com/KytesurfCat/status/1646501734221529089,1646501734221529089,replied_to,None,https://twitter.com/None/status/1646449668090363904,False,es,KytesurfCat,883007137772916736,"@profEHRBAR @btvnoticies Habla la lengua más usada en la ciudad de Barcelona, no como los inmigrantes lazitanos que vienen a Barcelona y pretenden que todo esté en catalán. #BCNIsNotCat",0,0,30,0,484,['false'],0,0,['false'],BCNIsNotCat,profEHRBAR;btvnoticies,Place;Place;Organization,Barcelona;Barcelona;BCNIsNotCat,false,MHP Kytesurfcat +=+= 🇪🇺,4960,4924,143425,9
2023-05-09 10:36:56.333894,(inmigrantes Barcelona OR inmigración Barcelona) lang:es -is:retweet,2023-04-13T10:58:42.000Z,https://twitter.com/DaniMval/status/1646467942597513219,1646467942597513219,replied_to,None,https://twitter.com/None/status/1646467172368109569,False,es,DaniMval,1619965311800811521,"@juliiadii @OnerSpik @A3Noticias Todo.
Las comunidades con más inmigración magrebí son las que están a la cabeza en violaciones y delincuencia.
Pero seguir mirando para otro lado.
El ejemplo perfecto Barcelona.",0,1,0,0,20,['false'],0,0,['false'],false,juliiadii;OnerSpik;A3Noticias,Organization,Barcelona,false,Dani M,15,130,1399,0
2023-05-09 10:36:56.333894,(inmigrantes Barcelona OR inmigración Barcelona) lang:es -is:retweet,2023-04-13T10:43:58.000Z,https://twitter.com/DeigenitrixES/status/1646464235524825089,1646464235524825089,original,false,https://twitter.com/DeigenitrixES/status/1646464235524825089/photo/1,False,es,DeigenitrixES,1061897106808553472,"Nos explica Mª Jesús Fuente que Violante, la nueva reina de Aragón, para recorrer más de 2000 km desde Esztergom a Barcelona, trae consigo escoltas, cocineros, tesoreros, palafreneros … Es lo que S. de Vajay llama ""inmigración de élite"". De entonces: frontal de Avià #Barcelona https://t.co/IyJGgiiKEn",22,6,145,1,10121,['photo'],None,None,['https://pbs.twimg.com/media/FtlpJdHXgAAhAGs.jpg'],Barcelona,false,Other;Place;Place;Place;Person;Person;Place;Place,Jesús Fuente;Aragón;Esztergom;Barcelona;.;Vajay;Avià;Barcelona,false,Deigenitrix,4904,1447,9111,53
2023-05-09 10:36:56.333894,(inmigrantes Barcelona OR inmigración Barcelona) lang:es -is:retweet,2023-04-13T10:39:10.000Z,https://twitter.com/AlbertoCaliu/status/1646463030757056514,1646463030757056514,original,false,None,False,es,AlbertoCaliu,1203827984181997568,"De estos dos días que he pasado en Barcelona me quedo con esto:

La cantidad de gente que está hasta los cojones de tanta basura woke, de inmigración ilegal y del separatismo.

Me ha asombrado mucho la cantidad de gente que me ha dicho que por primera vez va a votar a @vox_es.",881,187,2687,27,68769,['false'],0,0,['false'],false,vox_es,Place,Barcelona,false,Alberto Caliu🇪🇦,14019,7858,22653,18
2023-05-09 10:36:56.333894,(inmigrantes Barcelona OR inmigración Barcelona) lang:es -is:retweet,2023-04-13T09:25:07.000Z,https://twitter.com/paulxl/status/1646444394113892353,1646444394113892353,replied_to,None,https://twitter.com/None/status/1646421806549434369,False,es,paulxl,17648282,@yanopodomas @Cescbaez @juliolleonart ¿Te paso los tuits de los últimos siete días de gente quejándose de que se celebre la feria de abril en Barcelona diciendo que no es su cultura e ignorando la palada de catalanes que son descendientes de inmigrantes andaluces que llegaron a Cataluña en los 60?,0,1,0,0,18,['false'],0,0,['false'],false,yanopodomas;Cescbaez;juliolleonart,Place;Place,Barcelona;Cataluña,false,@paulxl@paquita.masto.host,2886,4943,263341,89
2023-05-09 10:36:56.333894,(inmigrantes Barcelona OR inmigración Barcelona) lang:es -is:retweet,2023-04-12T22:16:44.000Z,https://twitter.com/Sevenh01/status/1646276189932355589,1646276189932355589,replied_to,None,https://twitter.com/None/status/1646127993650130945,False,es,Sevenh01,1267375908027076608,"@AlbertoCaliu @gonzalodeoro Barcelona se a convertido así como lo es madrid, desde que se trajeron a la lacra de otros sitios... menas,inmigrantes ilegales, bandas juveniles, hace 30 años podrias andar tranquilamente por las calles,ahora tienes que llevarte un RPG para estar mínimamente protegido",0,1,0,0,34,['false'],0,0,['false'],false,AlbertoCaliu;gonzalodeoro,Organization;Organization;Other,Barcelona;madrid;RPG,false,🐂,10,21,508,0
2023-05-09 10:36:56.333894,(inmigrantes Barcelona OR inmigración Barcelona) lang:es -is:retweet,2023-04-12T21:25:12.000Z,https://twitter.com/Manuel56807725/status/1646263220103938049,1646263220103938049,replied_to,None,https://twitter.com/None/status/1646132997958123520,False,es,Manuel56807725,1169611775114928128,@ValerPortillo @Geopol21 @Geomigraciones @IEMed_ @IDEE_USPCEU @CidobBarcelona @Sahel_Intel @Mei_Barcelona La inmigración irregular hay que frenarla. Es un problema muy complejo pero que se ha convertido en todo un negocio en Africa del que se beneficia el crimen organizado y parte de la población que a la vez favorecen a la inestabilidad para seguir manteniendo un negocio lucrativo,0,1,0,0,44,['false'],0,0,['false'],false,ValerPortillo;Geopol21;Geomigraciones;IEMed_;IDEE_USPCEU;CidobBarcelona;Sahel_Intel;Mei_Barcelona,Place,Africa,false,Manuel Paz,243,925,3114,3
2023-05-09 10:36:56.333894,(inmigrantes Barcelona OR inmigración Barcelona) lang:es -is:retweet,2023-04-12T13:57:58.000Z,https://twitter.com/magnoamable/status/1646150669164740609,1646150669164740609,replied_to,false,https://twitter.com/false/status/1646149217109389317,False,es,magnoamable,1555914871170015234,"Es insalvable. Manadas de perros callejeros controlan Barcelona. Menas por todos lados . Pakistaníes salidos. Y donde no hay inmigración hay indepes estrogenizados . No vayáis . No es un meme. 

No vayáis",7,1,106,0,5358,['false'],0,0,['false'],false,false,Place,Barcelona,false,🇷🇸🔱CARLOMAGNO🔱🇷🇸,12019,410,4647,19
2023-05-09 10:36:56.333894,(inmigrantes Barcelona OR inmigración Barcelona) lang:es -is:retweet,2023-04-12T08:13:46.000Z,https://twitter.com/JULIASIMONPLAZA/status/1646064050466373634,1646064050466373634,quoted,false,https://twitter.com/AnabelAlonso_of/status/1645888626176278529,False,es,JULIASIMONPLAZA,387252940,"Y a los 2000 inmigrantes que estaban en una casa de Barcelona viviendo censados que, a eso que le decimos y la colau sabiéndolo, poca vergüenza la vara de nadir igual para todos, aaaa esque están las elecciones a la vuelta de la esquina https://t.co/n6wynScT96",0,0,0,0,24,['false'],0,0,['false'],false,false,Place,Barcelona,false,JULIA SIMON PLAZA,1,16,359,0
2023-05-09 10:36:56.333894,(inmigrantes Barcelona OR inmigración Barcelona) lang:es -is:retweet,2023-04-12T07:47:00.000Z,https://twitter.com/HispaniaRevelde/status/1646057315341152256,1646057315341152256,replied_to,Dannyelsan1613,https://twitter.com/Dannyelsan1613/status/1646055861112954883,False,es,HispaniaRevelde,1001905937786048518,"@Dannyelsan1613 El problema no son los turistas que vienen a dejar dinero,  lo es la inmigración ilegal y sus múltiples delitos diarios. 
Has destrozado mi ciudad Barcelona.
Ahora lo harás tú cuando las urnas te echen.",0,0,2,0,25,['false'],0,0,['false'],false,Dannyelsan1613,Place,Barcelona,false,"Hispania Re""V""elde",11454,7916,50318,6
2023-05-09 10:36:56.333894,(inmigrantes Barcelona OR inmigración Barcelona) lang:es -is:retweet,2023-04-12T05:49:05.000Z,https://twitter.com/Willi1807/status/1646027638903906306,1646027638903906306,replied_to,BCNmetropoli,https://twitter.com/BCNmetropoli/status/1646026663350743042,False,es,Willi1807,175706877,@BCNmetropoli ¿veis como no todos rebuscan en las basuras o viven alquilando locales ocupados a inmigrantes sin papeles?... ¡en Barcelona tenemos grandes oportunidades para jóvenes emprendedores!,0,0,0,0,84,['false'],0,0,['false'],false,BCNmetropoli,Place,Barcelona,false,Willi1807,376,633,28475,12
