retrieved_at,query,tweet_created_at,tweet_url,tweet_id,tweet_type,in_reply_to_name,referenced_tweets,sensitive,lang,username,user_id,text,rt_count,reply_count,like_count,quote_count,impression_count,has_media,if_video_duration,if_video_views,media_url,ent_hashtags,ent_mentions,ent_anotation_types,ent_anotation_elements,place_name,visible_user_name,followers_count,following_count,user_total_tweets,listed_on
2023-05-09 10:36:56.333894,(inmigrantes Barcelona OR inmigración Barcelona) lang:es -is:retweet,2023-05-02T16:00:33.000Z,https://twitter.com/BECAES_/status/1653429278308958213,1653429278308958213,replied_to,false,https://gaceta.es/espana/el-candidato-del-pp-a-la-alcaldia-de-barcelona-a-favor-de-empadronar-a-todos-los-inmigrantes-ilegales-20230502-1432/,False,es,BECAES_,459202451,"PP /💙 LA PSOE AZUL

El candidato del PP a la alcaldía de Barcelona, a favor de empadronar a todos los inmigrantes ilegales

https://t.co/lWQDlGolZT https://t.co/WKO7G2uqHW",1,1,1,0,191,['photo'],None,None,['https://pbs.twimg.com/media/FvIpJ7ZWcAExkqI.png'],false,false,Organization;Organization;Organization;Place,PP;PSOE;PP;Barcelona,false,𝗕𝗘𝗖𝗔𝗘𝗦 ,20065,20558,1395056,378
2023-05-09 10:36:56.333894,(inmigrantes Barcelona OR inmigración Barcelona) lang:es -is:retweet,2023-05-02T15:58:42.000Z,https://twitter.com/baucent/status/1653428812464488452,1653428812464488452,original,false,https://gaceta.es/espana/el-candidato-del-pp-a-la-alcaldia-de-barcelona-a-favor-de-empadronar-a-todos-los-inmigrantes-ilegales-20230502-1432/,False,es,baucent,281085297,"El candidato del PP a la alcaldía de Barcelona, a favor de empadronar a todos los inmigrantes ilegales https://t.co/bRiPG5QVS1 vía @gaceta_es",0,0,0,0,8,['false'],0,0,['false'],false,gaceta_es,Organization;Place,PP;Barcelona,false,baucent ن 🇪🇸,3183,4981,28690,11
2023-05-09 10:36:56.333894,(inmigrantes Barcelona OR inmigración Barcelona) lang:es -is:retweet,2023-05-02T15:37:44.000Z,https://twitter.com/Jtpallares/status/1653423535631597571,1653423535631597571,original,false,https://gaceta.es/espana/el-candidato-del-pp-a-la-alcaldia-de-barcelona-a-favor-de-empadronar-a-todos-los-inmigrantes-ilegales-20230502-1432/,False,es,Jtpallares,3220879199,"PPSOE en estado puro:
El candidato del PP a la alcaldía de Barcelona, a favor de empadronar a todos los inmigrantes ilegales 👇🏻https://t.co/hXQe3iGNIk vía @gaceta_es",9,0,7,0,121,['false'],0,0,['false'],false,gaceta_es,Organization;Organization;Place,PPSOE;PP;Barcelona,false,José Tortosa,294,108,14293,6
2023-05-09 10:36:56.333894,(inmigrantes Barcelona OR inmigración Barcelona) lang:es -is:retweet,2023-05-02T15:35:42.000Z,https://twitter.com/JesusGddP/status/1653423023536439301,1653423023536439301,original,false,https://gaceta.es/espana/el-candidato-del-pp-a-la-alcaldia-de-barcelona-a-favor-de-empadronar-a-todos-los-inmigrantes-ilegales-20230502-1432/,False,es,JesusGddP,405084332,"Cómo no, el PP con las mismas políticas del PSOE...

El candidato del PP a la alcaldía de Barcelona, a favor de empadronar a todos los inmigrantes ilegales https://t.co/pFBBgBL1e1",0,0,0,0,27,['false'],0,0,['false'],false,false,Organization;Organization;Organization;Place,PP;PSOE;PP;Barcelona,false,Jesús Gd,798,679,26537,17
2023-05-09 10:36:56.333894,(inmigrantes Barcelona OR inmigración Barcelona) lang:es -is:retweet,2023-05-02T15:23:25.000Z,https://twitter.com/Mila87723614/status/1653419932699246596,1653419932699246596,quoted,false,https://twitter.com/gaceta_es/status/1653378805703102471,False,es,Mila87723614,1207332036366782464,"El candidato de @ppopular a la alcaldía de 
Barcelona, @danielsirera, Daniel Sierra, es partidario de empadronar a todos los inmigrantes ilegales para que tengan acceso a derechos y políticas sociales, es decir, para que tengamos la obligación de trabajar para mantenerlos!
⬇️⬇️ https://t.co/Vej7QcL31H",20,3,30,0,409,['false'],0,0,['false'],false,ppopular;danielsirera,Place;Person,Barcelona;Daniel Sierra,false,Mila,14444,14604,74559,19
2023-05-09 10:36:56.333894,(inmigrantes Barcelona OR inmigración Barcelona) lang:es -is:retweet,2023-05-02T15:12:08.000Z,https://twitter.com/TORNADO8012/status/1653417090450178050,1653417090450178050,original,false,https://gaceta.es/espana/el-candidato-del-pp-a-la-alcaldia-de-barcelona-a-favor-de-empadronar-a-todos-los-inmigrantes-ilegales-20230502-1432/,False,es,TORNADO8012,1264227117233037313,"¿Alguien es capaz de encontrar la diferencia entre los filoetarras de la PiSOE y, entre la derechita cøbarde adalid de la agenda☠️2030?
Ambos son la misma 💩 y huelen igual de mal.
#SoloQuedaVOX 💚💪🇪🇸

https://t.co/9VJPniO864",0,0,0,0,13,['false'],0,0,['false'],SoloQuedaVOX,false,Organization;Person,PiSOE;adalid,false,"🇪🇸 Tango, Oscar, November, India 🇪🇸",151,0,13064,0
2023-05-09 10:36:56.333894,(inmigrantes Barcelona OR inmigración Barcelona) lang:es -is:retweet,2023-05-02T15:06:31.000Z,https://twitter.com/RobinLawley2/status/1653415680732016641,1653415680732016641,replied_to,None,https://twitter.com/None/status/1653401355678040072,False,es,RobinLawley2,1551638131157483522,"@_Fachar_ @gaceta_es Hay algo que no entiendo de Barcelona. Odian los turistas que dejan dinero y aman los inmigrantes que nos quitan el dinero,ya sea con ayudas o de otra manera, ya me entiendes.",5,8,27,0,405,['false'],0,0,['false'],false,_Fachar_;gaceta_es,Place,Barcelona,false,𝙇𝙖 𝙍𝙤𝙗𝙞𝙣,18796,6661,33937,16
2023-05-09 10:36:56.333894,(inmigrantes Barcelona OR inmigración Barcelona) lang:es -is:retweet,2023-05-02T15:01:06.000Z,https://twitter.com/Pilli_64/status/1653414314164748290,1653414314164748290,original,false,https://gaceta.es/espana/el-candidato-del-pp-a-la-alcaldia-de-barcelona-a-favor-de-empadronar-a-todos-los-inmigrantes-ilegales-20230502-1432/,False,es,Pilli_64,1430670818,"El candidato del PP a la alcaldía de Barcelona, a favor de empadronar a todos los inmigrantes ilegales https://t.co/2Ws1AqyuIJ a través de @gaceta_es",0,0,0,0,3,['false'],0,0,['false'],false,gaceta_es,Organization;Place,PP;Barcelona,false,Pilli,1674,1984,61076,11
2023-05-09 10:36:56.333894,(inmigrantes Barcelona OR inmigración Barcelona) lang:es -is:retweet,2023-05-02T14:31:48.000Z,https://twitter.com/patarrocas/status/1653406942201511940,1653406942201511940,original,false,https://gaceta.es/espana/el-candidato-del-pp-a-la-alcaldia-de-barcelona-a-favor-de-empadronar-a-todos-los-inmigrantes-ilegales-20230502-1432/,False,es,patarrocas,806585748,"PoncioPilatos 
El candidato del PP a la alcaldía de Barcelona, a favor de empadronar a todos los inmigrantes ilegales https://t.co/fT8qUi8lVf vía @gaceta_es",0,0,0,0,7,['false'],0,0,['false'],false,gaceta_es,Organization;Place,PP;Barcelona,false,Sito llñll Madrid Castilla España 2000,1996,2744,256964,56
2023-05-09 10:36:56.333894,(inmigrantes Barcelona OR inmigración Barcelona) lang:es -is:retweet,2023-05-02T14:23:56.000Z,https://twitter.com/Botellinhelao/status/1653404962821488648,1653404962821488648,replied_to,None,https://www.solosequenosenada.com/2014/01/22/mini-historia-de-catalunya/amp/,False,es,Botellinhelao,1651354855900889088,"@BcnValue @la_tarambana A ver cuando os enterais que si quitais de Barcelona a inmigrantes y turistas alli quedan tres paletos queriendo defender a capa y espada una comunidad autonoma con menos historia de España. Hace Tres dias erais de la Corona de Aragón.
Leete esto anda.
https://t.co/cUUo0uALMS https://t.co/5Up89CyzbG",1,0,0,0,16,['photo'],None,None,['https://pbs.twimg.com/media/FvITDVDXwAQV7b4.png'],false,BcnValue;la_tarambana,Place;Place;Other;Place,Barcelona;España;Corona;Aragón,false,Botellin Congelao,13,141,278,0
2023-05-09 10:36:56.333894,(inmigrantes Barcelona OR inmigración Barcelona) lang:es -is:retweet,2023-05-02T14:22:40.000Z,https://twitter.com/criminalidad/status/1653404644792582146,1653404644792582146,original,false,https://ift.tt/J4W3ItV,False,es,criminalidad,48988302,"El candidato del PP a la alcaldía de Barcelona, a favor de empadronar a todos los ... - LA GACETA https://t.co/X9qjeiQxEd",0,0,0,0,5,['false'],0,0,['false'],false,false,Organization;Place;Other,PP;Barcelona;GACETA,false,Arturo Siso Sosa,341,65,5487,1
2023-05-09 10:36:56.333894,(inmigrantes Barcelona OR inmigración Barcelona) lang:es -is:retweet,2023-05-02T14:09:36.000Z,https://twitter.com/_Fachar_/status/1653401355678040072,1653401355678040072,original,false,https://gaceta.es/espana/el-candidato-del-pp-a-la-alcaldia-de-barcelona-a-favor-de-empadronar-a-todos-los-inmigrantes-ilegales-20230502-1432/,False,es,_Fachar_,1528928776561823744,"El PP ha renunciado a dar la batalla.

El candidato del PP a la alcaldía de Barcelona, a favor de empadronar a todos los inmigrantes ilegales https://t.co/7T3YDgo82I a través de @gaceta_es",22,9,29,2,959,['false'],0,0,['false'],false,gaceta_es,Organization;Organization;Place,PP;PP;Barcelona,false,F͎A͎C͎H͎A͎R͎,5970,6109,27534,9
2023-05-09 10:36:56.333894,(inmigrantes Barcelona OR inmigración Barcelona) lang:es -is:retweet,2023-05-02T14:09:22.000Z,https://twitter.com/surexpreso/status/1653401298136358916,1653401298136358916,original,false,https://gaceta.es/espana/el-candidato-del-pp-a-la-alcaldia-de-barcelona-a-favor-de-empadronar-a-todos-los-inmigrantes-ilegales-20230502-1432/,False,es,surexpreso,2230746659,"Todos con papeles y @ppopular
espero que sin votos.

https://t.co/kzwuaCjdz0",0,0,0,0,12,['false'],0,0,['false'],false,ppopular,false,false,false,Surexpreso,1066,2070,28508,11
2023-05-09 10:36:56.333894,(inmigrantes Barcelona OR inmigración Barcelona) lang:es -is:retweet,2023-05-02T14:08:09.000Z,https://twitter.com/J_EnriqueLeal/status/1653400992354795520,1653400992354795520,original,false,https://gaceta.es/espana/el-candidato-del-pp-a-la-alcaldia-de-barcelona-a-favor-de-empadronar-a-todos-los-inmigrantes-ilegales-20230502-1432/,False,es,J_EnriqueLeal,799328902321754112,"El candidato del PP a la alcaldía de Barcelona, a favor de empadronar a todos los inmigrantes ilegales https://t.co/X4BppkYWAG vía @gaceta_es",0,0,0,0,4,['false'],0,0,['false'],false,gaceta_es,Organization;Place,PP;Barcelona,false,José Enrique Leal,413,453,22932,4
2023-05-09 10:36:56.333894,(inmigrantes Barcelona OR inmigración Barcelona) lang:es -is:retweet,2023-05-02T13:31:03.000Z,https://twitter.com/EstoyDeVuelta10/status/1653391654169071621,1653391654169071621,original,false,https://gaceta.es/espana/el-candidato-del-pp-a-la-alcaldia-de-barcelona-a-favor-de-empadronar-a-todos-los-inmigrantes-ilegales-20230502-1432/,False,es,EstoyDeVuelta10,1586664346725253120,"Venga ""votontos"" del ""pepe"".
¿Ya lo tenéis un poquito más claro?.
#SoloQuedaVox

https://t.co/ZiQMHTKW6R",0,1,0,0,4,['false'],0,0,['false'],SoloQuedaVox,false,false,false,false,EstoyDeVuelta 💚🇪🇸💚,1179,1199,2960,0
2023-05-09 10:36:56.333894,(inmigrantes Barcelona OR inmigración Barcelona) lang:es -is:retweet,2023-05-02T13:20:57.000Z,https://twitter.com/BretonsCarlos/status/1653389112064221189,1653389112064221189,original,false,https://gaceta.es/espana/el-candidato-del-pp-a-la-alcaldia-de-barcelona-a-favor-de-empadronar-a-todos-los-inmigrantes-ilegales-20230502-1432/,False,es,BretonsCarlos,1306303389232492544,"PSOE y PP son lo mismo:
El candidato del PP a la alcaldía de Barcelona, a favor de empadronar a todos los inmigrantes ilegales https://t.co/XgqBId6bXI via @gaceta_es",0,1,1,0,38,['false'],0,0,['false'],false,gaceta_es,Organization;Organization;Organization;Place,PSOE;PP;PP;Barcelona,false,Carlos Bretons ن🇪🇸,610,309,32664,5
2023-05-09 10:36:56.333894,(inmigrantes Barcelona OR inmigración Barcelona) lang:es -is:retweet,2023-05-02T13:15:32.000Z,https://twitter.com/bferrer10/status/1653387748286316544,1653387748286316544,original,false,https://gaceta.es/espana/el-candidato-del-pp-a-la-alcaldia-de-barcelona-a-favor-de-empadronar-a-todos-los-inmigrantes-ilegales-20230502-1432/,False,es,bferrer10,3240913424,"ALIENTA EL «EFECTO LLAMADA»
El candidato del PP a la alcaldía de Barcelona, a favor de empadronar a todos los inmigrantes ilegales https://t.co/yc0L1oTm1w",0,0,0,0,24,['false'],0,0,['false'],false,false,Organization;Place,PP;Barcelona,false,B. Ferrer 💚 #SoloquedaVOX,15793,15755,62813,11
2023-05-09 10:36:56.333894,(inmigrantes Barcelona OR inmigración Barcelona) lang:es -is:retweet,2023-05-02T12:45:20.000Z,https://twitter.com/Jrive19/status/1653380150359203845,1653380150359203845,replied_to,sanchezcastejon,https://twitter.com/sanchezcastejon/status/1653317559469350913,False,es,Jrive19,1360544068997165060,"@sanchezcastejon Todo lo que quieras pero se debería expulsar a aquellos inmigrantes CON ANTECEDENTES o REINCIDENTES, Madrid es muy bonito como para que poco a poco se convierta en la 2da Barcelona.",0,0,0,0,9,['false'],0,0,['false'],false,sanchezcastejon,Organization;Place,Madrid;Barcelona,false,Jrive,4,30,81,0
2023-05-09 10:36:56.333894,(inmigrantes Barcelona OR inmigración Barcelona) lang:es -is:retweet,2023-05-02T12:41:17.000Z,https://twitter.com/PR0GREST0NA/status/1653379129599750144,1653379129599750144,quoted,false,https://twitter.com/predatole/status/1653293581442883588,False,es,PR0GREST0NA,766273691101622272,Barcelona la ciudad sin Ley de los inmigrantes ilegales de Ada Colau. https://t.co/LJPijzZkyW,1,0,2,0,96,['false'],0,0,['false'],false,false,Place;Place,Barcelona;Ada Colau,false,Progrestona,10108,8778,44771,54
2023-05-09 10:36:56.333894,(inmigrantes Barcelona OR inmigración Barcelona) lang:es -is:retweet,2023-05-02T12:40:00.000Z,https://twitter.com/gaceta_es/status/1653378805703102471,1653378805703102471,original,false,https://gaceta.es/espana/el-candidato-del-pp-a-la-alcaldia-de-barcelona-a-favor-de-empadronar-a-todos-los-inmigrantes-ilegales-20230502-1432/,False,es,gaceta_es,17214331,"El candidato del PP a la alcaldía de Barcelona se muestra a favor de empadronar a todos los inmigrantes ilegales

https://t.co/IyyUUQHyOi",269,53,199,44,74282,['false'],0,0,['false'],false,false,Organization;Place,PP;Barcelona,false,La Gaceta de la Iberosfera,241359,118,75534,2229
2023-05-09 10:36:56.333894,(inmigrantes Barcelona OR inmigración Barcelona) lang:es -is:retweet,2023-05-02T11:46:29.000Z,https://twitter.com/Franquista1992/status/1653365338451456000,1653365338451456000,original,false,https://twitter.com/Franquista1992/status/1653365338451456000/video/1,False,es,Franquista1992,1424095953154347012,"La inmigración yihadista se sabe fuera de la ley, imágenes del Metro de Barcelona . https://t.co/Z5jMofqmcW",65,14,125,8,5533,['video'],63.533,2561,['None'],false,false,Place,Barcelona,false,Franquista,11666,517,9159,24
2023-05-09 10:36:56.333894,(inmigrantes Barcelona OR inmigración Barcelona) lang:es -is:retweet,2023-05-02T09:37:32.000Z,https://twitter.com/yoymimiata/status/1653332887574392833,1653332887574392833,replied_to,la_tarambana,https://twitter.com/la_tarambana/status/1652947753985613824,False,es,yoymimiata,1349761627546116100,"@la_tarambana Tienes razón, Barcelona es más una ciudad que sólo extranjeros pueden disfrutar, ya que las políticas de inmigración hacen imposible al trabajador medio progresar adecuadamente en Barcelona. Una pena.",0,0,0,0,12,['false'],0,0,['false'],false,la_tarambana,Organization;Place,Barcelona;Barcelona,false,YoYmiMiata,2,40,562,0
2023-05-09 10:36:56.333894,(inmigrantes Barcelona OR inmigración Barcelona) lang:es -is:retweet,2023-05-02T08:51:41.000Z,https://twitter.com/micasma/status/1653321348762988547,1653321348762988547,replied_to,sanchezcastejon,https://twitter.com/sanchezcastejon/status/1653317559469350913,False,es,micasma,229456536,"@sanchezcastejon ""Tierra de acogida, plural, diversa, abierta, ..de adopción"" que en el lenguale del mentiroso traidor, significa que tiene el objetivo de convertir Madrid en lo mismo que ha convertido Barcelona y tantas otras. En el pozo de la inmigración ilegal, la oKupación y la delincuencia.",3,0,8,0,147,['false'],0,0,['false'],false,sanchezcastejon,Place;Place,Madrid;Barcelona,false,Deuda Mínima Vital 🇪🇸,219,247,6190,0
2023-05-09 10:36:56.333894,(inmigrantes Barcelona OR inmigración Barcelona) lang:es -is:retweet,2023-05-02T07:34:05.000Z,https://twitter.com/CarlesBort/status/1653301819282472962,1653301819282472962,replied_to,Rita_Maestre,https://twitter.com/Rita_Maestre/status/1653300094777565184,False,es,CarlesBort,1517507041807507456,"@Rita_Maestre En Barcelona, a pesar de los tópicos, también nos da igual de donde venga la gente. Llevamos más de cien años recibiendo inmigración. Mi abuela paterna, por ejemplo. Ojalá este espíritu fuera general.",0,1,3,0,855,['false'],0,0,['false'],false,Rita_Maestre,Place,Barcelona,false,C. Bort C.,100,588,1066,0
2023-05-09 10:36:56.333894,(inmigrantes Barcelona OR inmigración Barcelona) lang:es -is:retweet,2023-05-02T06:44:33.000Z,https://twitter.com/kkaaannonn/status/1653289353970438145,1653289353970438145,replied_to,None,https://twitter.com/None/status/1653248026260000768,False,es,kkaaannonn,1502157617451257858,"@esRadio @eslamananadeFJL Lo de Bolaños y el Ppsoe es para parecer que se llevan mal, porqur bien que criticaron a Esperanza Aguirre por implantar el 2 de mayo. Igual es una treta como las charlas en Barcelona para inmigrantes para el arraigo y conseguir los papeles por estar.",0,0,1,0,46,['false'],0,0,['false'],false,esRadio;eslamananadeFJL,Person;Organization;Person;Place,Bolaños;Ppsoe;Esperanza Aguirre;Barcelona,false,kanon,10,8,208,0
2023-05-09 10:36:56.333894,(inmigrantes Barcelona OR inmigración Barcelona) lang:es -is:retweet,2023-05-01T23:01:49.000Z,https://twitter.com/Sarasamy03/status/1653172904371027969,1653172904371027969,replied_to,ErnestoEkaizer,https://twitter.com/ErnestoEkaizer/status/1652758191510306816,False,es,Sarasamy03,933182358,"@ErnestoEkaizer A quiénes han preguntado? La mayoría de sus habitantes estamos deseando que se largue ya.  Los únicos votos que sacará serán de los inmigrantes delincuentes, okupas o sectarios. BARCELONA ES UN BASURERO QUE DA MIEDO.",0,0,0,0,23,['false'],0,0,['false'],false,ErnestoEkaizer,false,false,false,Sara,2576,3415,34247,2
2023-05-09 10:36:56.333894,(inmigrantes Barcelona OR inmigración Barcelona) lang:es -is:retweet,2023-05-01T22:51:43.000Z,https://twitter.com/Botellinhelao/status/1653170363507851269,1653170363507851269,replied_to,VirginiaSanroma,https://twitter.com/VirginiaSanroma/status/1652306575384510464,False,es,Botellinhelao,1651354855900889088,"@VirginiaSanroma Que bien se vende a Barcelona.... Inmigrantes, separatistas, rateros,..... Y no los dejamos separarse?  Alto tabique ponia yo. Jajajajaja",0,0,0,0,2,['false'],0,0,['false'],false,VirginiaSanroma,Place,Barcelona,false,Botellin Congelao,13,141,278,0
2023-05-09 10:36:56.333894,(inmigrantes Barcelona OR inmigración Barcelona) lang:es -is:retweet,2023-05-01T20:32:04.000Z,https://twitter.com/juanjognunez/status/1653135219036135431,1653135219036135431,replied_to,None,https://twitter.com/None/status/1652978768091258885,False,es,juanjognunez,937997992191250434,@Jujonomi87 @carlosbm99 Tambien habrá que ver el tipo de población que se han censado en esas ciudades porque yo estoy viviendo en Barcelona y aquí hay un problema con la inmigración magrebí tremendo que yo para Sevilla no lo quiero.,0,0,0,0,31,['false'],0,0,['false'],false,Jujonomi87;carlosbm99,Place;Organization,Barcelona;Sevilla,false,Juan Jose Gonzalez,53,191,163,0
2023-05-09 10:36:56.333894,(inmigrantes Barcelona OR inmigración Barcelona) lang:es -is:retweet,2023-05-01T20:03:13.000Z,https://twitter.com/vicentico2302/status/1653127959157284877,1653127959157284877,replied_to,la_tarambana,https://twitter.com/la_tarambana/status/1652947753985613824,False,es,vicentico2302,1513575173932425225,"@la_tarambana Barcelona actualmente es un estercolero de delincuencia, okupas, inmigrantes de esa nacionalidad musulmana que no se puede nombrar o te llaman facha, vamos el paraiso de los delincuentes, carteristas y chusma varia, no voy alli ni pagandome",0,0,0,0,21,['false'],0,0,['false'],false,la_tarambana,Place,Barcelona,false,Vicentico,47,52,2075,0
2023-05-09 10:36:56.333894,(inmigrantes Barcelona OR inmigración Barcelona) lang:es -is:retweet,2023-05-01T19:01:28.000Z,https://twitter.com/josep_saumell/status/1653112418065604619,1653112418065604619,replied_to,Taiytotsuki1,https://twitter.com/Taiytotsuki1/status/1650421605057658880,False,es,josep_saumell,1521857479365251072,"@Taiytotsuki1 Es la respuesta al a por ellos y la entrada de inmigrantes a Barcelona y bo a Madrid, te enteras, lista, ya sabes, quedate en tu país y apunto solucionado",0,0,0,0,15,['false'],0,0,['false'],false,Taiytotsuki1,Place;Place,Barcelona;Madrid,false,josjos,45,67,3376,0
2023-05-09 10:36:56.333894,(inmigrantes Barcelona OR inmigración Barcelona) lang:es -is:retweet,2023-05-01T16:21:20.000Z,https://twitter.com/Reivaj_R/status/1653072120312741900,1653072120312741900,replied_to,None,https://twitter.com/Reivaj_R/status/1653072120312741900/video/1,False,es,Reivaj_R,759975849152118784,@SergioChouza @Pontifex_es Metro de Barcelona. Un pasajero va a sacar su billete y unos magrebíes intentan robarle la mochila. El hombre se resiste y aparecen nuevos asaltantes que le propinan hasta 11 puñaladas. Consecuencias de abriri indiscriminadamente la inmigración. https://t.co/3mZIU7JoeE,0,0,0,0,58,['video'],28.755,14,['None'],false,SergioChouza;Pontifex_es,Place,Barcelona,false,Red_Sparrow,8,51,1331,0
2023-05-09 10:36:56.333894,(inmigrantes Barcelona OR inmigración Barcelona) lang:es -is:retweet,2023-05-01T15:51:58.000Z,https://twitter.com/GuillermodeBas3/status/1653064730871836673,1653064730871836673,quoted,false,https://twitter.com/la_tarambana/status/1652947753985613824,False,es,GuillermodeBas3,1243277655312662534,"Barcelona es actualmente el mayor estercolero de inmigración, vandalismo y toda clase de actos similares en España.

Cállate y deja de decir payasadas. https://t.co/wQ6OV1y7Vx",0,0,0,0,26,['false'],0,0,['false'],false,false,Organization;Place,Barcelona;España,false,Fray Guillermo de Baskerville,177,482,12759,0
2023-05-09 10:36:56.333894,(inmigrantes Barcelona OR inmigración Barcelona) lang:es -is:retweet,2023-05-01T12:32:13.000Z,https://twitter.com/Jei91711396/status/1653014460716535808,1653014460716535808,replied_to,nostalgicpablo_,https://twitter.com/nostalgicpablo_/status/1652300720702357508,False,es,Jei91711396,937638125836427264,@nostalgicpablo_ Pues no cojas el metro de Barcelona. Sobretodo es curioso porque cuando más alto es el % de inmigrantes es por la noche. Debe ser que los pobres se pasan trabajando desde las 6 de la mañana hasta las 11 de la noche,1,0,1,0,43,['false'],0,0,['false'],false,nostalgicpablo_,Place,Barcelona,false,openhands 🫃🏾👳🏽‍♂️⚧🔻🇹🇷🏳️‍🌈🇦🇴🇵🇸,254,223,4661,0
2023-05-09 10:36:56.333894,(inmigrantes Barcelona OR inmigración Barcelona) lang:es -is:retweet,2023-05-01T12:11:01.000Z,https://twitter.com/Fenomeno1986/status/1653009123309395969,1653009123309395969,replied_to,la_tarambana,https://twitter.com/la_tarambana/status/1652947753985613824,False,es,Fenomeno1986,1498739207610765319,@la_tarambana Y de negros inmigrantes ladrones es Barcelona.,0,0,1,0,6,['false'],0,0,['false'],false,la_tarambana,Place,Barcelona,false,Fenomeno,26,883,1383,2
2023-05-09 10:36:56.333894,(inmigrantes Barcelona OR inmigración Barcelona) lang:es -is:retweet,2023-05-01T11:23:25.000Z,https://twitter.com/PABLO_MarRo1/status/1652997144683372544,1652997144683372544,replied_to,dsantosfacher,https://twitter.com/dsantosfacher/status/1652947943375228928,False,es,PABLO_MarRo1,1163833598887301121,"@dsantosfacher Sii, Barcelona está como está y como vemos desde fuera. Los madrizleños tampoco estáis para rascaros la barriga. Con las bandas-inmigración tenéis de que preocuparos",0,0,0,0,6,['false'],0,0,['false'],false,dsantosfacher,Organization,Barcelona,false,Pablo M.,6,54,2230,0
2023-05-09 10:36:56.333894,(inmigrantes Barcelona OR inmigración Barcelona) lang:es -is:retweet,2023-05-01T11:15:00.000Z,https://twitter.com/latigode7puntas/status/1652995028589871105,1652995028589871105,replied_to,Pam_Angela_,https://twitter.com/Pam_Angela_/status/1652980383108018181,False,es,latigode7puntas,1624893503464525824,@Pam_Angela_ Al chico de 15 que han asesinado en Barcelona que le den no???? Ah que han sido inmigrantes y no vale para hacer tu mierda de política....,0,0,0,0,16,['false'],0,0,['false'],false,Pam_Angela_,Place,Barcelona,false,latigode7puntas,19,148,446,0
2023-05-09 10:36:56.333894,(inmigrantes Barcelona OR inmigración Barcelona) lang:es -is:retweet,2023-05-01T10:31:28.000Z,https://twitter.com/BondHortensio/status/1652984072006762496,1652984072006762496,replied_to,RevenKV,https://twitter.com/RevenKV/status/1652790938274615296,False,es,BondHortensio,731900759411986432,"@RevenKV Ah pues nada, se les perdona el hecho de que solo en Barcelona el 80% de los delitos los cometan inmigrantes. 

 No pasa nada, sigamos llenando el país de delincuentes.",0,0,1,0,56,['false'],0,0,['false'],false,RevenKV,Place,Barcelona,false,Capitán Facha,4,30,155,0
2023-05-09 10:36:56.333894,(inmigrantes Barcelona OR inmigración Barcelona) lang:es -is:retweet,2023-05-01T00:17:57.000Z,https://twitter.com/El_1r_Profeta/status/1652829677331906561,1652829677331906561,replied_to,None,https://twitter.com/None/status/1652749355709878277,False,es,El_1r_Profeta,896110243,@Chino_Chulo @josepmas8 Realmente crees que alguno de estos va hacer que Barcelona sea mejor ciudad? Jajajaja yo solo veo a los extremistas capaces de erradicar el turismo masivo y la inmigración descontrolada,0,0,0,0,18,['false'],0,0,['false'],false,Chino_Chulo;josepmas8,Organization,Barcelona,false,Elprofeta,205,377,11561,11
